{
  "$id": "https://aletheos.ai/schemas/fre_support_mode_receipt_v0.2.schema.json",
  "$schema": "https://json-schema.org/draft/2020-12/schema",
  "additionalProperties": false,
  "allOf": [
    {
      "if": {
        "properties": {
          "claim": {
            "properties": {
              "status": {
                "const": "earned"
              }
            },
            "required": [
              "status"
            ]
          }
        },
        "required": [
          "claim"
        ]
      },
      "then": {
        "properties": {
          "comparison": {
            "properties": {
              "reference_congruence": {
                "type": "boolean"
              }
            }
          },
          "controls": {
            "properties": {
              "negative_controls_passed": {
                "type": "boolean"
              }
            }
          },
          "gate": {
            "properties": {
              "admitted": {
                "const": true
              }
            }
          },
          "operation_names": {
            "allOf": [
              {
                "contains": {
                  "const": "ContextGen"
                }
              },
              {
                "contains": {
                  "const": "KeyGen"
                }
              },
              {
                "contains": {
                  "const": "EvalMultKeyGen"
                }
              },
              {
                "contains": {
                  "const": "Encrypt"
                }
              },
              {
                "contains": {
                  "const": "EvalAdd"
                }
              },
              {
                "contains": {
                  "const": "EvalMult"
                }
              },
              {
                "contains": {
                  "const": "DecryptVerify"
                }
              }
            ],
            "minItems": 7
          }
        }
      }
    }
  ],
  "properties": {
    "boundary": {
      "items": {
        "minLength": 1,
        "type": "string"
      },
      "minItems": 1,
      "type": "array",
      "uniqueItems": true
    },
    "circuit_id": {
      "const": "support_mode_polynomial_v0.1"
    },
    "claim": {
      "oneOf": [
        {
          "additionalProperties": false,
          "properties": {
            "result": {
              "type": "boolean"
            },
            "status": {
              "const": "earned"
            },
            "type": {
              "const": "regularity"
            }
          },
          "required": [
            "type",
            "status",
            "result"
          ],
          "type": "object"
        },
        {
          "additionalProperties": false,
          "properties": {
            "result": {
              "type": "null"
            },
            "status": {
              "enum": [
                "unavailable",
                "rejected"
              ]
            },
            "type": {
              "const": "regularity"
            }
          },
          "required": [
            "type",
            "status",
            "result"
          ],
          "type": "object"
        }
      ]
    },
    "closure": {
      "additionalProperties": false,
      "properties": {
        "class": {
          "enum": [
            "open",
            "local",
            "historical",
            "observational"
          ]
        },
        "external_truth_claim": {
          "const": false
        }
      },
      "required": [
        "class",
        "external_truth_claim"
      ],
      "type": "object"
    },
    "comparison": {
      "additionalProperties": false,
      "properties": {
        "contract_sha256": {
          "const": "a7c28f080730aa5fa7f4183573b1270794c3246939137aac4240d90eaf5a69ba"
        },
        "execution_gate_id": {
          "const": "fre.support_mode.openfhe_execution_gate.v0.1"
        },
        "fre_pipeline_id": {
          "const": "support_mode_openfhe_v0.1"
        },
        "profile_id": {
          "const": "fre.openfhe.bgv.evalmult.executed.v0.1"
        },
        "reference_congruence": {
          "type": [
            "boolean",
            "null"
          ]
        },
        "reference_pipeline_id": {
          "const": "support_mode_reference_v0.1"
        },
        "rule": {
          "const": "exact_integer_equality"
        },
        "tolerance": {
          "const": 0
        }
      },
      "required": [
        "rule",
        "tolerance",
        "reference_congruence",
        "contract_sha256",
        "reference_pipeline_id",
        "fre_pipeline_id",
        "profile_id",
        "execution_gate_id"
      ],
      "type": "object"
    },
    "contract_id": {
      "const": "fre.support_mode.regularity.v0.2"
    },
    "controls": {
      "additionalProperties": false,
      "properties": {
        "negative_controls_passed": {
          "type": [
            "boolean",
            "null"
          ]
        }
      },
      "required": [
        "negative_controls_passed"
      ],
      "type": "object"
    },
    "envelope_id": {
      "pattern": "^[a-z0-9][a-z0-9._-]+$",
      "type": "string"
    },
    "gate": {
      "additionalProperties": false,
      "properties": {
        "admitted": {
          "type": "boolean"
        },
        "reason": {
          "minLength": 1,
          "type": "string"
        }
      },
      "required": [
        "admitted",
        "reason"
      ],
      "type": "object"
    },
    "input_certification": {
      "enum": [
        "certified_fixture_set_v0.1",
        "rejected",
        "unavailable"
      ]
    },
    "operation_names": {
      "items": {
        "enum": [
          "ContextGen",
          "KeyGen",
          "EvalMultKeyGen",
          "Encrypt",
          "EvalAdd",
          "EvalMult",
          "DecryptVerify"
        ]
      },
      "maxItems": 7,
      "type": "array",
      "uniqueItems": true
    },
    "privacy": {
      "additionalProperties": false,
      "properties": {
        "ciphertexts_exposed": {
          "const": false
        },
        "keys_exposed": {
          "const": false
        },
        "private_material_committed": {
          "const": false
        },
        "runtime_objects_committed": {
          "const": false
        },
        "secret_inputs_exposed": {
          "const": false
        }
      },
      "required": [
        "private_material_committed",
        "secret_inputs_exposed",
        "keys_exposed",
        "ciphertexts_exposed",
        "runtime_objects_committed"
      ],
      "type": "object"
    },
    "receipt_schema": {
      "const": "fre.support_mode.receipt.v0.2"
    },
    "source_class": {
      "const": "six_support_register"
    }
  },
  "required": [
    "receipt_schema",
    "envelope_id",
    "contract_id",
    "source_class",
    "input_certification",
    "circuit_id",
    "operation_names",
    "gate",
    "claim",
    "comparison",
    "controls",
    "privacy",
    "closure",
    "boundary"
  ],
  "title": "FRE Support Mode Public Receipt v0.2",
  "type": "object"
}
